ä»€éº¼èŒ¶?·æ˜¯?¨ä?æ³¡èŒ¶?Œå€’èŒ¶?„ï?,?¶å£º (Teapot),
What is the function of a Teapot (?¶å£º)?,It is used to brew and pour tea.,
?ªä??‹èŒ¶?·ç??Ÿèƒ½?¯ã€Œä?è­·èŒ¶å£ºè?æ¡Œå??ï?,å£ºå? (Teapot Pad),
What is the purpose of a Teapot Pad?,To protect the teapot and the table.,
The _____ is placed under the teapot to protect it and the table.,Teapot Pad (å£ºå?),
?¶ç??„è‹±?‡æ˜¯ä»€éº¼ï?,Tea Caddy,
What is a Tea Caddy (?¶ç?) used for?,To keep tea leaves fresh.,
?¨ä??Œè??¶è??„åœ°?¹ã€ç??¶å…·ç¨±ç‚ºä»€éº¼ï?,?¶ç? (Tea Caddy),
?¶é??„å??¨æ˜¯ä»€éº¼ï?,?ŠèŒ¶?‰æ¨?²å£ºè£¡ã€?Which tool is used to push tea leaves into the teapot?,Tea Pick (?¶é?)
What is the English term for a tool used to push tea leaves into the teapot?,Tea Pick,
?¨ä??Œæ??¶è??€?ºä??ç??¶å…·?¯ä?éº¼ï?,?¶å? (Tea Scoop),
What is the function of a Tea Scoop (?¶å?)?,To scoop out tea leaves.,
The Chinese term for a Tea Scoop is _____.,?¶å?,
?¶å·¾?„å??¨æ˜¯ä»€éº¼ï?,?¿ä??¦æ??¢æ??¶å…·??Which item is used to wipe tea tools and the table?,Tea Towel (?¶å·¾)
What is the Chinese term for a Tea Towel?,?¶å·¾,
ä»€éº¼æ˜¯?Œç”¨ä¾†å??¶ç??¯å??ï?,?¶æ¯ (Teacup),
A small cup for drinking tea is called a _____.,Teacup (?¶æ¯),
?¶æ¯?˜ç??Ÿç”¨?¯ä?éº¼ï?,?¾åœ¨?¶æ¯ä¸‹æ–¹ï¼Œä?è­·èŒ¶?¯ä¸¦ä¿æ?æ¡Œé¢ä¹¾æ·¨??What is placed under a teacup to keep it safe and clean?,Tea Saucer (?¶æ¯??
The English term for ?¶æ¯??is _____.,Tea Saucer,
?ªä??‹èŒ¶?·æ˜¯?¨ä??Œæ??¶æ¹¯å¹³å??„å€’åˆ°?¯å?è£¡ã€ï?,?¶æµ· (Serving Pot),
What is a Serving Pot (?¶æµ·) used for?,To pour tea evenly into the cups.,
The _____ ensures that tea is poured evenly into each cup.,Serving Pot (?¶æµ·),
æ°´æ–¹?„å??¨æ˜¯ä»€éº¼ï?,?’æ??¶æ¸£?Œå?é¤˜ç?æ°´ã€?Which item is used to collect leftover tea or rinse water?,Waste Bowl (æ°´æ–¹)
The Chinese term for a Waste Bowl in a tea set is _____.,æ°´æ–¹,
?Œç??¶ã€ç??±æ??¯ä?éº¼ï?,Green Tea,
What is ?Œç™½?¶ã€?in English?,White Tea,
?Œé??¶ã€ç??±æ??¯ä?éº¼ï?,Yellow Tea,
What is ?Œç?é¾èŒ¶??in English?,Oolong Tea,
?Œç??¶ã€ç??±æ??¯ä?éº¼ï?,Black Tea,
What is ?Œé??¶ã€?in English?,Dark Tea,
What is Green Tea in Traditional Chinese?,ç¶ èŒ¶,
What is White Tea in Traditional Chinese?,?½èŒ¶,
What is Yellow Tea in Traditional Chinese?,é»ƒèŒ¶,
What is Oolong Tea in Traditional Chinese?,?é???What is Black Tea in Traditional Chinese?,ç´…èŒ¶
What is Dark Tea in Traditional Chinese?,é»‘èŒ¶,
"The name of the booklet is ""Be a Little Tea Master with _____.""",Three Acts of Goodness,
What is the concept that combines the practice of tea and Zen meditation?,Tea Chan (?¶ç¦ª),
"What are the ""Three Acts of Goodness"" promoted by Fo Guang Shan? (ä½›å?å±±æ??¡ç??Œä?å¥½ã€æ˜¯?ªä?ä»¶ä?ï¼?",,
What is the English for ?šå¥½äº?,,
What is the English for èªªå¥½è©?,,
What is the English for å­˜å¥½å¿?,,
"What is the Chinese for ""Do Good Deeds""?",,
"ä¸‰å¥½?‹å??¯ï??šå¥½äº‹ã€_____?å?å¥½å???èªªå¥½è©?""According to the analogy",,
"According to the analogy, what do people need to become talented? (?¹æ?è­¬å–»ï¼Œäºº?€è¦ä?éº¼æ??½æ??ºäºº?ï?)",,
Helping someone who has fallen is an example of which act of goodness? (å¹«åŠ©è·Œå€’ç?äººæ˜¯?Œä?å¥½ã€ä¸­?„å“ªä¸€?…ï?),,
"Saying ""please"" and ""thank you"" is an example of which act of goodness? (èªªã€Œè??å??Œè?è¬ã€æ˜¯?Œä?å¥½ã€ä¸­?„å“ªä¸€?…ï?)",,
Silently wishing for your friend to succeed on a test is an example of which act of goodness? (?¨å?è£¡ç?ç¦æ??‹è€ƒè©¦?å??¯ã€Œä?å¥½ã€ä¸­?„å“ªä¸€?…ï?),,
"Venerable Master Hsing Yun often asked, ""What can I _____ for you?"" (?Ÿé›²å¤§å¸«å¸¸å?ï¼šã€Œæ??„å¯ä»¥ç‚º?¨å?ä»€éº¼ï???",,
"In Tea Chan (?¶ç¦ª), what is a simple good deed you can do for others? (?¨èŒ¶ç¦ªè£¡ï¼Œä??¯ä»¥?ºåˆ¥äººå??„ä?ä»¶ç°¡?®å¥½äº‹æ˜¯ä»€éº¼ï?)",,
Which of the Three Acts of Goodness is an internal action that happens in your mind? (ä¸‰å¥½ä¸­ï??ªä??…æ˜¯?¼ç??¨å?è£¡ã€åˆ¥äººç?ä¸è??„ï?),,
"The course title ""Little Tea Master"" is associated with which organization? (?Œå??¶å¸«?èª²ç¨‹è??ªå€‹å–®ä½æ??œï?)",,
What is the topic for group discussion mentioned in the lesson? (èª²ç?ä¸­æ??°ç?å°ç?è¨è?ä¸»é??¯ä?éº¼ï?),,
"One student wrote, ""Courage is doing what you're _____ to do."" (ä¸€ä½å­¸?Ÿå¯«ä¸‹ï??Œå?æ°?˜¯?»å?ä½ æ?_____?„ä??‚ã€?",,
A student's note expresses gratitude for whom for making the tables and chairs? (ä¸€ä½å­¸?Ÿç?ç­†è??Ÿè?èª°è£½ä½œæ?æ¤…ï?),,
A student's note expresses gratitude for the people who _____ the tea. (ä¸€ä½å­¸?Ÿç?ç­†è??Ÿè?_____?„äºº??,,
What question can you ask in English to offer help? (ä½ å¯ä»¥ç”¨?ªå¥?±æ?ä¾†ä¸»?•æ?ä¾›å¹«?©ï?),,
What is a good phrase to say when offering someone tea? (è«‹äºº?èŒ¶?‚å¯ä»¥èªª?„ä??¥å¥½è©±æ˜¯ä»€éº¼ï?),,
"The question ""What can I speak good words for you?"" asks what in Chinese? (?ŒWhat can I speak good words for you??ç?ä¸­æ??æ€æ˜¯ä»€éº¼ï?)",,
"Which of the Three Acts of Goodness do you practice when you encourage a friend by saying ""You can do it!""? (?¶ä?å°æ??‹èªª?Œä??¯ä»¥?„ï??ä?é¼“å‹µä»–æ?ï¼Œä?æ­?œ¨å¯¦è?ä¸‰å¥½ä¸­ç??ªä??…ï?)",,
"When you decide to be patient instead of getting angry, which act of goodness are you practicing? (?¶ä?æ±ºå?ä¿æ??å??Œä??¯ç?æ°??ï¼Œä?æ­?œ¨å¯¦è?ä¸‰å¥½ä¸­ç??ªä??…ï?)",,
Sharing your snacks with a classmate is an example of which act of goodness? (è·Ÿå?å­¸å?äº«ä??„é?å¿ƒæ˜¯ä¸‰å¥½ä¸­ç??ªä??…ï?),,
"According to a student's notes, who should be thanked for building the Twin Pavilions? (?¹æ?å­¸ç?ç­†è?ï¼Œæ?è¬èª°å»ºä??™é–£æ¨“ï?)",,
